{
  "id": "nops/ancillary_chunk_padding",
  "name": "Ancillary Chunk Padding",
  "category": "nop",
  "supported_platforms": [
    "cross_platform"
  ],
  "supported_arch": [
    "any"
  ],
  "author": "PixelFerrite Team",
  "version": "0.2.0",
  "options": [],
  "safety_level": "simulation_only"
}
