{
  "id": "exploits/jpg_restart_marker_desync_sim",
  "name": "JPG Restart Marker Desync Sim",
  "category": "exploit",
  "supported_platforms": [
    "cross_platform"
  ],
  "supported_arch": [
    "any"
  ],
  "author": "PixelFerrite Team",
  "version": "0.2.0",
  "options": [],
  "safety_level": "authorized_assessment_only"
}
