{
  "id": "payloads/linux/telemetry_linux",
  "name": "Telemetry Linux",
  "category": "payload",
  "supported_platforms": [
    "linux"
  ],
  "supported_arch": [
    "x64",
    "x86",
    "arm64"
  ],
  "author": "PixelFerrite Team",
  "version": "0.1.0",
  "options": [],
  "safety_level": "simulation_only"
}
