{
  "id": "evasion/timing_jitter_delivery",
  "name": "Timing Jitter Delivery",
  "category": "evasion",
  "supported_platforms": [
    "cross_platform"
  ],
  "supported_arch": [
    "any"
  ],
  "author": "PixelFerrite Team",
  "version": "0.2.0",
  "options": [],
  "safety_level": "authorized_assessment_only"
}
