{
  "id": "detection/metadata_anomaly_scanner",
  "name": "Metadata Anomaly Scanner",
  "category": "detection",
  "supported_platforms": [
    "cross_platform"
  ],
  "supported_arch": [
    "any"
  ],
  "author": "PixelFerrite Team",
  "version": "0.1.0",
  "options": [],
  "safety_level": "simulation_only"
}
