{
  "id": "exploits/icc_chunk_length_mismatch_sim",
  "name": "ICC Chunk Length Mismatch Sim",
  "category": "exploit",
  "supported_platforms": [
    "cross_platform"
  ],
  "supported_arch": [
    "any"
  ],
  "author": "PixelFerrite Team",
  "version": "0.2.0",
  "options": [],
  "safety_level": "simulation_only"
}
