{
  "id": "payloads/macos/launchd_inventory_macos",
  "name": "Launchd Inventory macOS",
  "category": "payload",
  "supported_platforms": [
    "macos"
  ],
  "supported_arch": [
    "x64",
    "arm64"
  ],
  "author": "PixelFerrite Team",
  "version": "0.2.0",
  "options": [
    {
      "name": "RHOSTS",
      "description": "Target host list.",
      "required": false
    }
  ],
  "safety_level": "authorized_assessment_only"
}
