{
  "id": "encoders/polymorphic_encoder",
  "name": "Polymorphic Encoder",
  "category": "encoder",
  "supported_platforms": [
    "cross_platform"
  ],
  "supported_arch": [
    "any"
  ],
  "author": "PixelFerrite Team",
  "version": "0.1.0",
  "options": [],
  "safety_level": "simulation_only"
}
