{
  "id": "evasion/edge_energy_smoothing",
  "name": "Edge Energy Smoothing",
  "category": "evasion",
  "supported_platforms": [
    "cross_platform"
  ],
  "supported_arch": [
    "any"
  ],
  "author": "PixelFerrite Team",
  "version": "0.2.0",
  "options": [],
  "safety_level": "simulation_only"
}
